bookId,titleSlug,authorId,authorName,headline,teaser,description,themeConcept,keyTakeaways,actionableIdeas,audience,styleTone,,usp,topics,setting,impactfulPassages,authorBio,bookQuotes,authorQuotes
319531,curtsies-conspiracies,394982,Gail Carriger,"A steampunk adventure filled with espionage, charm, and wit at a secret finishing school for spies","Follow Sophronia as she uncovers a web of intrigue and danger in a world of steampunk elegance and espionage.","<p>Curtsies & Conspiracies takes readers on a delightful journey into a world of steampunk adventures and espionage. Gail Carriger weaves an engaging tale set in a finishing school where young women learn the art of espionage alongside dance and etiquette. Sophronia, the clever and resourceful protagonist, finds herself at the center of a dangerous plot, forcing her to navigate the treacherous waters of friendship, loyalty, and intrigue.</p><p>The novel offers a fascinating blend of humor and suspense, with richly detailed descriptions of a world where steam-powered inventions and Victorian elegance coexist. The school itself becomes a character, brimming with secrets and surprises.</p><p>As Sophronia delves deeper into the mysteries surrounding her, she encounters colorful characters, from enigmatic teachers to suspicious peers, each contributing to the layered narrative. The book balances its thrilling plot with moments of warmth and wit, making it a thoroughly enjoyable read.</p><p>Readers are treated to a unique perspective on what it means to come of age in a world where appearances are deceiving and survival often depends on one's ability to think several steps ahead.</p><p>With its mix of steampunk elements, strong female characters, and a captivating storyline, Curtsies & Conspiracies is a must-read for fans of unconventional adventures and clever storytelling.</p><p>The novel leaves readers eagerly anticipating Sophronia's next escapade, proving that espionage can be as elegant as it is thrilling.</p>","The balance of etiquette and espionage in a steampunk world | Friendship and loyalty amidst deception and intrigue | The art of subterfuge and critical thinking in dangerous situations","Espionage and etiquette can coexist with finesse | Loyalty is tested under the shadow of deceit | Critical thinking and quick wit are essential for survival","Practice thinking several steps ahead in problem-solving | Value loyalty and friendship even in challenging situations | Explore unconventional paths to personal growth and learning","Fans of steampunk, espionage thrillers, and clever female protagonists","Lighthearted yet suspenseful, with a touch of humor and elegance. The tone is witty and engaging, and the mood is adventurous.","A perfect blend of steampunk aesthetics, clever storytelling, and a strong, resourceful heroine in a world of intrigue","Steampunk|Espionage|Victorian elegance|Coming of age|Friendship","A steampunk finishing school","The clink of steam-powered gadgets and the rustle of petticoats blended seamlessly in a dance of intrigue and danger | Sophronia's quick wit was her most valuable weapon in a world where deception ruled","Gail Carriger is a New York Times bestselling author known for her steampunk novels filled with humor, charm, and unique world-building. Her works often feature strong female protagonists and intricate plots.","Elegance is a form of power, especially when paired with knowledge | In a world of deception, loyalty is the rarest treasure | Every mystery, no matter how complex, starts with a single clue","The art of storytelling is finding humor in the serious and depth in the light | Strong women in extraordinary circumstances redefine the boundaries of strength | A world is built not just on steam and gears but on the imagination of its creator"
313468,the-wrong-side-of-goodbye,393491,Michael Connelly,"A gripping Harry Bosch mystery that bridges the past and present with suspense and heart","Harry Bosch confronts the ghosts of his past while chasing justice in a case that will change everything.","<p>The Wrong Side of Goodbye is a masterfully crafted mystery that explores themes of redemption, justice, and personal sacrifice. Michael Connelly brings back the beloved detective Harry Bosch, now working as a private investigator and part-time cop in a small California town. Bosch is hired by a reclusive billionaire to find a possible heir, a case that takes him deep into the man's secretive past.</p><p>As Bosch uncovers long-buried secrets, he is also drawn into a dangerous hunt for a serial rapist. The dual narratives intertwine seamlessly, showcasing Bosch's relentless pursuit of the truth and his unwavering commitment to justice.</p><p>Connelly's writing is taut and immersive, pulling readers into Bosch's world with vivid descriptions and authentic dialogue. The story is as much about the characters as it is about the mystery, with Bosch's internal struggles adding depth to the narrative.</p><p>The novel's pacing is impeccable, with each revelation propelling the story forward. Connelly's attention to detail and ability to create suspense make this book a page-turner from start to finish.</p><p>The Wrong Side of Goodbye is more than just a mystery; it's a reflection on the choices we make and the legacies we leave behind. It's a compelling read for both longtime fans and newcomers to the series.</p><p>As Bosch faces his own mortality, he reminds us that the pursuit of justice is a lifelong journey, one that often comes with personal cost.</p>","The duality of justice and personal redemption | The impact of past decisions on present circumstances | The resilience of the human spirit in the face of adversity","Justice often requires personal sacrifice | The past shapes the present in ways we cannot always foresee | Resilience is key to overcoming life's challenges","Seek truth even when it comes at a cost | Reflect on how past decisions influence the present | Embrace resilience as a tool for personal growth","Fans of crime mysteries, detective stories, and morally complex characters","Taut and immersive, with a mix of suspense and emotional depth. The tone is reflective, and the mood is gripping.","A deeply layered mystery with dual narratives that showcase Connelly's mastery of suspense and character development","Crime mystery|Detective story|Personal redemption|Justice and resilience","Contemporary California","Bosch looked at the old photographs, the shadows of a life that had passed but still lingered in the present | Justice was not a destination but a journey, often winding and treacherous","Michael Connelly is a critically acclaimed author and creator of the Harry Bosch series. His works are known for their intricate plots, authentic characters, and compelling storytelling.","The truth is never simple, but it's always worth finding | Justice is a mirror; it reflects who we are and what we value | A good detective is not just a solver of mysteries but a seeker of truths","Writing is an exploration of humanity, with all its flaws and triumphs | Every mystery is a window into the human soul | The best stories are those that challenge us to think and feel deeply"
314895,the-demon-in-the-wood,389808,Leigh Bardugo,"A haunting prequel that reveals the origin story of the Darkling from the Grishaverse","Discover the tragic roots of the Darkling, a feared and powerful figure in the Grishaverse.","<p>The Demon in the Wood is a compelling prequel that delves into the haunting backstory of the Darkling, a pivotal character in Leigh Bardugo's Grishaverse. This novella takes readers to a time before he became the feared and revered figure we know, painting a portrait of a young boy burdened with extraordinary power.</p><p>Set in a world fraught with danger and prejudice, the story follows the Darkling as he and his mother wander through hostile lands, hiding their true identities and extraordinary abilities. The novella explores the challenges of survival in a world that fears and rejects those who are different.</p><p>Bardugo masterfully captures the complexities of the Darkling's character, weaving a tale of loneliness, ambition, and the desperate need for belonging. Readers will gain a deeper understanding of what drives him and how his past shaped his path toward darkness.</p><p>The narrative is rich with emotion and tension, offering glimpses of the choices and sacrifices that defined the Darkling's fate. It serves as both a standalone story and a valuable addition to the Grishaverse, deepening the lore and enriching the experience for fans of the series.</p><p>The Demon in the Wood is a poignant exploration of power, identity, and the fine line between heroism and villainy. It's a must-read for fans of Leigh Bardugo and those who crave stories of complex characters navigating morally ambiguous worlds.</p><p>Prepare to see the Darkling in a new light as you uncover the origins of one of the Grishaverse's most enigmatic figures.</p>","The cost of power and its impact on identity | The desire for belonging in a world of rejection | The thin line between heroism and villainy","Extraordinary power often isolates its wielder | Identity is shaped by the challenges and prejudices one faces | The path to darkness is paved with difficult choices","Reflect on how power shapes your interactions with others | Embrace individuality even when faced with rejection | Consider the consequences of your choices on your personal journey","Fans of the Grishaverse, fantasy lovers, and those who enjoy morally complex characters","Dark and poignant, with a narrative that balances tension and emotion. The tone is introspective, and the mood is haunting.","An origin story that deepens the lore of the Grishaverse while offering a fresh perspective on a pivotal character","Fantasy|Grishaverse|Origin stories|Power and identity|Moral ambiguity","Fantasy world, pre-Grishaverse era","Power is a double-edged sword, cutting both its wielder and those around them | The world is not kind to those it fears, and fear shapes much of the Darkling's early life","Leigh Bardugo is a bestselling author known for her richly imagined Grishaverse novels. Her stories often feature complex characters, intricate plots, and morally ambiguous themes.","The past holds the keys to understanding the present, even when the answers are painful | Power is not inherently evil, but it requires responsibility and restraint | Belonging is a fundamental human need, but it often comes at a cost","Stories are bridges to empathy, allowing us to see the world through the eyes of others | Fantasy is a mirror, reflecting truths about our own world through the lens of the extraordinary | The best characters are those who challenge our perceptions and provoke thought"
283558,more-fool-me,364666,Stephen Fry,"A candid and witty memoir exploring fame, excess, and the search for self-awareness","Stephen Fry recounts his years of wild success, indulgence, and personal discovery with humor and honesty.","<p>More Fool Me is Stephen Fry's brutally honest and endlessly entertaining memoir that takes readers through a whirlwind period of his life. Known for his charm, wit, and intellectual prowess, Fry delves into the highs and lows of his years of fame, success, and indulgence.</p><p>The memoir offers an unfiltered look at Fry's experiences with excess, from his professional triumphs to his struggles with addiction. It paints a vivid picture of a man navigating the pressures of public life while grappling with personal demons.</p><p>Fry's writing is as engaging as ever, filled with sharp observations, self-deprecating humor, and profound insights. He invites readers to join him on a journey of reflection, offering a candid glimpse into the lessons he's learned along the way.</p><p>While the memoir is deeply personal, it also resonates with universal themes of self-awareness, resilience, and the pursuit of meaning in a chaotic world. Fry's ability to balance humor with sincerity makes for a reading experience that is both thought-provoking and entertaining.</p><p>More Fool Me is not just a memoir; it's a celebration of life's complexities, a reminder that even in our darkest moments, there is room for growth and redemption.</p><p>Stephen Fry's story is a testament to the resilience of the human spirit and the power of honesty in the face of adversity. It's a must-read for fans of his work and anyone seeking inspiration through authenticity.</p>","The challenges of fame and its impact on personal identity | The journey from excess to self-awareness | The resilience of the human spirit in overcoming adversity","Fame often comes with hidden costs | Self-awareness is key to navigating life's challenges | Resilience allows us to find meaning even in struggle","Reflect on how external success aligns with personal values | Embrace honesty and authenticity in your own life | Seek help and growth when faced with adversity","Fans of memoirs, Stephen Fry enthusiasts, and those interested in stories of resilience and self-discovery","Candid and witty, blending humor with profound insights. The tone is reflective, and the mood is both lighthearted and poignant.","A refreshingly honest memoir that balances wit and wisdom to explore the complexities of fame and personal growth","Memoir|Fame and identity|Resilience|Personal discovery|Addiction and recovery","Contemporary celebrity life","Fame is a double-edged sword, as alluring as it is perilous | Honesty is the first step toward healing and self-discovery","Stephen Fry is a celebrated author, actor, and comedian known for his sharp wit, intelligence, and captivating storytelling. His works span genres, from fiction to memoirs, always reflecting his unique voice.","Success is not defined by public acclaim but by personal fulfillment and authenticity | Humor is a powerful tool for processing pain and connecting with others | Life's challenges are not obstacles but opportunities for growth and understanding","Creativity is born from curiosity and the willingness to question | Humor is a lens through which we can view even the darkest moments with clarity | The most compelling stories are those that reveal the complexity of the human experience"
313293,the-cat-who-ate-danish-modern,396301,Lilian Jackson Braun,"A cozy mystery with a clever cat and an intrepid reporter at its heart","Join Jim Qwilleran and his Siamese cat Koko as they solve an art world murder mystery.","<p>The Cat Who Ate Danish Modern is a charming entry in Lilian Jackson Braun's beloved cozy mystery series. Set in a small town, the novel follows journalist Jim Qwilleran and his extraordinary Siamese cat, Koko, as they delve into the mysteries surrounding the art world.</p><p>When Qwilleran takes on an assignment to cover interior design, he stumbles upon a web of intrigue involving art theft and murder. With Koko's uncanny instincts and Qwilleran's journalistic curiosity, the duo uncovers secrets that lead them closer to the truth.</p><p>Braun's writing is warm and engaging, with a focus on character-driven storytelling. The small-town setting adds a layer of charm, while the art world backdrop provides an intriguing twist.</p><p>The novel is as much about the quirky relationship between Qwilleran and Koko as it is about the mystery itself. Their dynamic adds humor and heart to the story, making it a delightful read for fans of cozy mysteries.</p><p>The Cat Who Ate Danish Modern balances suspense with lighthearted moments, offering a perfect escape into a world of clever cats and curious minds. It's a testament to the enduring appeal of Braun's unique storytelling.</p><p>Whether you're a longtime fan of the series or a newcomer, this novel is sure to entertain with its mix of wit, mystery, and feline charm.</p>","The bond between humans and animals as a key to discovery | The intersection of art, design, and mystery | The charm of small-town life with a hint of intrigue","Animals can offer unique insights into human behavior | The art world is filled with secrets waiting to be uncovered | Curiosity is the driving force behind uncovering the truth","Pay attention to the unique dynamics between people and pets | Explore creative fields with a curious and open mind | Appreciate the small-town charm and its hidden depths","Fans of cozy mysteries, animal lovers, and those seeking lighthearted yet engaging stories","Warm and engaging, with a balance of humor and suspense. The tone is cozy, and the mood is lighthearted.","A cozy mystery that seamlessly blends art, intrigue, and the delightful bond between a journalist and his clever cat","Cozy mystery|Animals and humans|Art and design|Small-town charm|Whodunits","Small-town art world","Koko's tail twitched with purpose, a silent signal that there was more to the art collection than met the eye | The small-town gallery buzzed with whispers of intrigue, the kind only Koko and Qwilleran could unravel","Lilian Jackson Braun is a renowned author best known for her cozy mystery series featuring journalist Jim Qwilleran and his extraordinary cat, Koko. Her stories are filled with charm, wit, and engaging puzzles.","Curiosity is the heart of every great mystery, and cats are its perfect companions | Art speaks in whispers, and sometimes only the most curious minds can hear its secrets | Humor and warmth make even the darkest mysteries a delight to unravel","Stories are windows into the heart of humanity, even when told through the lens of a clever cat | The best mysteries are those that linger in your mind, leaving you eager for more | Writing is an exploration of the ordinary, turned extraordinary by the right perspective"
